{
  "curriculum": "cn-math-2022",
  "subject": "数学",
  "note": "每个数学微主题（mt_*）对《义务教育数学课程标准（2022年版）》小学部分的对齐记录。status: aligned=对上了课标条目；beyond-primary=中国课标中属于初中及以后；cn-out-of-scope=中国课标没有（如英制单位、罗马数字）。relation: exact=主题与条目基本一致；partial=主题只覆盖条目的一部分，或条目只覆盖主题的一部分。cnStage=所对条目中最早的学段（不计核心素养 HX.*）。review: llm-draft=由 Claude 依据课标逐条起草、尚未经教师审校；审校后改为 teacher-reviewed。topics.json 中 cn-math-2022:* 的 key 由 scripts/sync-cn-alignment.mjs 从本文件同步，请只改本文件。",
  "method": "LLM 起草：按领域分批，每个微主题只在对应领域的课标条目中选择；参考其原有 CCSS/英国课程编码判断年级。",
  "alignmentCount": 503,
  "alignments": [
    {
      "topicId": "mt_yJmvUCCym7",
      "topicName": "加法与减法应用题",
      "status": "aligned",
      "standards": [
        "cn-math-2022:S1.NA.SL.01",
        "cn-math-2022:S1.NA.SY.04"
      ],
      "relation": "partial",
      "cnStage": "S1",
      "confidence": 0.85,
      "rationale": "10以内加减解决问题（第一学段\"数量关系\"）",
      "review": "llm-draft"
    },
    {
      "topicId": "mt_OvyoRo47K-",
      "topicName": "加法即合并两组",
      "status": "aligned",
      "standards": [
        "cn-math-2022:S1.NA.SY.03"
      ],
      "relation": "exact",
      "cnStage": "S1",
      "confidence": 0.9,
      "rationale": "加法的意义（合并）",
      "review": "llm-draft"
    },
    {
      "topicId": "mt_e8CZ7E5qW7",
      "topicName": "凑十（10的组合）",
      "status": "aligned",
      "standards": [
        "cn-math-2022:S1.NA.SY.04"
      ],
      "relation": "partial",
      "cnStage": "S1",
      "confidence": 0.85,
      "rationale": "凑十，20以内进位加法的基础",
      "review": "llm-draft"
    },
    {
      "topicId": "mt_7XcCG43ZZW",
      "topicName": "把10以内的数拆成数对",
      "status": "aligned",
      "standards": [
        "cn-math-2022:S1.NA.SY.01",
        "cn-math-2022:S1.NA.SY.04"
      ],
      "relation": "partial",
      "cnStage": "S1",
      "confidence": 0.8,
      "rationale": "10以内数的分与合",
      "review": "llm-draft"
    },
    {
      "topicId": "mt_PgsHGYJMH-",
      "topicName": "用直观方式表示加减法",
      "status": "aligned",
      "standards": [
        "cn-math-2022:S1.NA.SY.03"
      ],
      "relation": "partial",
      "cnStage": "S1",
      "confidence": 0.8,
      "rationale": "用实物和图示表示加减法的意义",
      "review": "llm-draft"
    },
    {
      "topicId": "mt_zuKAX6lcYR",
      "topicName": "减法即拿走或分开",
      "status": "aligned",
      "standards": [
        "cn-math-2022:S1.NA.SY.03"
      ],
      "relation": "exact",
      "cnStage": "S1",
      "confidence": 0.9,
      "rationale": "减法的意义（去掉、分开）",
      "review": "llm-draft"
    },
    {
      "topicId": "mt_mr_Vk7FGzK",
      "topicName": "加法与减法",
      "status": "aligned",
      "standards": [
        "cn-math-2022:S1.NA.SY.04"
      ],
      "relation": "exact",
      "cnStage": "S1",
      "confidence": 0.9,
      "rationale": "20以内加减法（含0的运算）",
      "review": "llm-draft"
    },
    {
      "topicId": "mt_VAWV_l7J0D",
      "topicName": "早期应用题",
      "status": "aligned",
      "standards": [
        "cn-math-2022:S1.NA.SL.01"
      ],
      "relation": "exact",
      "cnStage": "S1",
      "confidence": 0.85,
      "rationale": "20以内一步解决问题",
      "review": "llm-draft"
    },
    {
      "topicId": "mt_ghF3Vv6taM",
      "topicName": "5以内熟练加减",
      "status": "aligned",
      "standards": [
        "cn-math-2022:S1.NA.SY.04"
      ],
      "relation": "partial",
      "cnStage": "S1",
      "confidence": 0.85,
      "rationale": "5以内加减法，是第一学段整数加减法的起点",
      "review": "llm-draft"
    },
    {
      "topicId": "mt_s2mfRBoTal",
      "topicName": "数的组合",
      "status": "aligned",
      "standards": [
        "cn-math-2022:S1.NA.SY.04"
      ],
      "relation": "partial",
      "cnStage": "S1",
      "confidence": 0.85,
      "rationale": "熟练口算20以内加减法",
      "review": "llm-draft"
    },
    {
      "topicId": "mt_8RmpkDxT9L",
      "topicName": "认读 +、− 和 = 符号",
      "status": "aligned",
      "standards": [
        "cn-math-2022:S1.NA.SY.03"
      ],
      "relation": "partial",
      "cnStage": "S1",
      "confidence": 0.8,
      "rationale": "认识 +、−、= 符号",
      "review": "llm-draft"
    },
    {
      "topicId": "mt_I5j1ZWo2cn",
      "topicName": "两位数加减整十的心算",
      "status": "aligned",
      "standards": [
        "cn-math-2022:S1.NA.SY.04"
      ],
      "relation": "exact",
      "cnStage": "S1",
      "confidence": 0.85,
      "rationale": "两位数加减整十数，百以内口算",
      "review": "llm-draft"
    },
    {
      "topicId": "mt_Zx1xZM-RbX",
      "topicName": "三个小数相加",
      "status": "aligned",
      "standards": [
        "cn-math-2022:S1.NA.SY.04"
      ],
      "relation": "partial",
      "cnStage": "S1",
      "confidence": 0.8,
      "rationale": "连加，可用凑十",
      "review": "llm-draft"
    },
    {
      "topicId": "mt_UQnAFPs83F",
      "topicName": "两个两位数相加",
      "status": "aligned",
      "standards": [
        "cn-math-2022:S1.NA.SY.04"
      ],
      "relation": "exact",
      "cnStage": "S1",
      "confidence": 0.9,
      "rationale": "两位数加减两位数",
      "review": "llm-draft"
    },
    {
      "topicId": "mt_glPPG-kTQY",
      "topicName": "100以内的加法",
      "status": "aligned",
      "standards": [
        "cn-math-2022:S1.NA.SY.04"
      ],
      "relation": "exact",
      "cnStage": "S1",
      "confidence": 0.9,
      "rationale": "100以内加法",
      "review": "llm-draft"
    },
    {
      "topicId": "mt_PpWSHA-0kv",
      "topicName": "加法与减法策略",
      "status": "aligned",
      "standards": [
        "cn-math-2022:S1.NA.SY.04"
      ],
      "relation": "partial",
      "cnStage": "S1",
      "confidence": 0.8,
      "rationale": "接着数、倒着数的计算策略",
      "review": "llm-draft"
    },
    {
      "topicId": "mt_m1W6nTQJ2b",
      "topicName": "20以内的加法与减法",
      "status": "aligned",
      "standards": [
        "cn-math-2022:S1.NA.SY.04"
      ],
      "relation": "exact",
      "cnStage": "S1",
      "confidence": 0.9,
      "rationale": "凑十法、破十法，20以内加减",
      "review": "llm-draft"
    },
    {
      "topicId": "mt_QCgbiVrwnp",
      "topicName": "加法顺序任意",
      "status": "aligned",
      "standards": [
        "cn-math-2022:S1.NA.SY.04",
        "cn-math-2022:S2.NA.SY.04"
      ],
      "relation": "partial",
      "cnStage": "S1",
      "confidence": 0.75,
      "rationale": "第一学段计算中会体验交换加数；加法交换律作为运算律在第二学段",
      "review": "llm-draft"
    },
    {
      "topicId": "mt_ezc2m_0dzN",
      "topicName": "求加法中的未知数",
      "status": "aligned",
      "standards": [
        "cn-math-2022:S1.NA.SY.03"
      ],
      "relation": "partial",
      "cnStage": "S1",
      "confidence": 0.8,
      "rationale": "减法是加法的逆运算（想加算减）",
      "review": "llm-draft"
    },
    {
      "topicId": "mt__we2TDqnJx",
      "topicName": "10以内熟练加减",
      "status": "aligned",
      "standards": [
        "cn-math-2022:S1.NA.SY.04"
      ],
      "relation": "exact",
      "cnStage": "S1",
      "confidence": 0.9,
      "rationale": "10以内加减法熟练",
      "review": "llm-draft"
    },
    {
      "topicId": "mt_3e_PQxwC12",
      "topicName": "熟练的加法与减法",
      "status": "aligned",
      "standards": [
        "cn-math-2022:S1.NA.SY.04"
      ],
      "relation": "exact",
      "cnStage": "S1",
      "confidence": 0.9,
      "rationale": "20以内加减熟练并推到百以内",
      "review": "llm-draft"
    },
    {
      "topicId": "mt_T76hKqXf0z",
      "topicName": "分组相加",
      "status": "aligned",
      "standards": [
        "cn-math-2022:S2.NA.SY.04"
      ],
      "relation": "partial",
      "cnStage": "S2",
      "confidence": 0.75,
      "rationale": "加法结合律属第二学段运算律",
      "review": "llm-draft"
    },
    {
      "topicId": "mt_ehGS_uVSJv",
      "topicName": "逆运算：加法抵消减法",
      "status": "aligned",
      "standards": [
        "cn-math-2022:S1.NA.SY.03"
      ],
      "relation": "exact",
      "cnStage": "S1",
      "confidence": 0.85,
      "rationale": "加减互逆，用于验算",
      "review": "llm-draft"
    },
    {
      "topicId": "mt_AKAtWEwpcj",
      "topicName": "两位数加减一位数的口算",
      "status": "aligned",
      "standards": [
        "cn-math-2022:S1.NA.SY.04"
      ],
      "relation": "exact",
      "cnStage": "S1",
      "confidence": 0.85,
      "rationale": "两位数加减一位数口算",
      "review": "llm-draft"
    },
    {
      "topicId": "mt_wzAZ8qFDc4",
      "topicName": "加法与减法的心算和笔算",
      "status": "aligned",
      "standards": [
        "cn-math-2022:S1.NA.SY.04",
        "cn-math-2022:S1.NA.SL.01"
      ],
      "relation": "partial",
      "cnStage": "S1",
      "confidence": 0.8,
      "rationale": "口算笔算加减并解决问题",
      "review": "llm-draft"
    },
    {
      "topicId": "mt_HJTuIGHvcR",
      "topicName": "减去整十数",
      "status": "aligned",
      "standards": [
        "cn-math-2022:S1.NA.SY.04"
      ],
      "relation": "exact",
      "cnStage": "S1",
      "confidence": 0.85,
      "rationale": "整十数加减整十数",
      "review": "llm-draft"
    },
    {
      "topicId": "mt_3JgrHY221M",
      "topicName": "加减法中的未知数",
      "status": "aligned",
      "standards": [
        "cn-math-2022:S1.NA.SY.03"
      ],
      "relation": "partial",
      "cnStage": "S1",
      "confidence": 0.7,
      "rationale": "求加减式中的未知数（□+5=8），依据加减关系",
      "review": "llm-draft"
    },
    {
      "topicId": "mt_oIzycTBeE4",
      "topicName": "等号的含义",
      "status": "aligned",
      "standards": [
        "cn-math-2022:S1.NA.SY.02"
      ],
      "relation": "partial",
      "cnStage": "S1",
      "confidence": 0.8,
      "rationale": "等号表示相等，课标\"感悟相等和不等关系\"",
      "review": "llm-draft"
    },
    {
      "topicId": "mt_SrrsLiJkr3",
      "topicName": "三位数加减法笔算",
      "status": "aligned",
      "standards": [
        "cn-math-2022:S1.NA.SY.04"
      ],
      "relation": "exact",
      "cnStage": "S1",
      "confidence": 0.85,
      "rationale": "三位数加减法笔算（第一学段学业要求）",
      "review": "llm-draft"
    },
    {
      "topicId": "mt_TiQbi027PE",
      "topicName": "把数相加",
      "status": "aligned",
      "standards": [
        "cn-math-2022:S1.NA.SY.04"
      ],
      "relation": "partial",
      "cnStage": "S1",
      "confidence": 0.75,
      "rationale": "多个两位数连加",